{
  "objectType": "Evidence",
  "objectId": "EVD-0127",
  "state": "VERIFIED",
  "taskId": "TASK-0019",
  "type": "MAIN_VERIFICATION",
  "trustLevel": "MAIN_VERIFIED",
  "subject": {
    "subjectDigest": null,
    "repository": "Catzpro01/n8n-rust-v.4",
    "prNumber": null,
    "url": null,
    "subjectType": "MAIN",
    "subjectId": "944d4fc51001f9ffd13a1c0ccfadd4165ea12aa9"
  },
  "result": {
    "metrics": {},
    "failureClass": null,
    "status": "PASS",
    "summary": "fresh clone of main 944d4fc5: tree == PR head, workforce 104/104, gates 7/7, cert OK, backend 2400/2400, frontend 451/0/1skip, 0 dirty; main CI ALL_GREEN"
  },
  "producedBy": "MANAGER-01",
  "verifiedAt": "2026-09-25T07:38:12Z",
  "verifiedBy": "MANAGER-01",
  "reason": null,
  "schemaVersion": "1.0",
  "revision": 3,
  "createdAt": "2026-09-25T07:38:12Z",
  "updatedAt": "2026-09-25T07:38:12Z",
  "events": [
    "EVT-001117",
    "EVT-001118",
    "EVT-001119"
  ]
}
